{
    "addUserWizard": {
        "heading": "Invite Parent Users",
        "description": "Invite users from the parent organization.",
        "hint": "Invited users are managed by the parent organization.",
        "username": {
            "label": "Usernames",
            "placeholder": "Enter the usernames",
            "hint": "Add the username of a parent user and press enter. Repeat to include multiple users.",
            "validations": {
                "required": "At least one user should be selected."
            }
        },
        "groups": {
            "label": "Groups",
            "placeholder": "Select groups",
            "hint": "Assign groups for the user that is being invited.",
            "validations": {
                "required": "Groups is a required field."
            }
        },
        "inviteButton": "Invite"
    },
    "tab": {
        "usersTab": "Users",
        "invitationsTab": "Invitations"
    },
    "searchPlaceholder": "Search by Username",
    "searchdropdown": {
        "pendingLabel": "Pending",
        "expiredLabel": "Expired"
    },
    "createDropdown": {
        "createLabel": "Create User",
        "inviteLabel": "Invite Parent User"
    },
    "filterLabel": "Filter by: ",
    "emptyPlaceholder": {
        "noPendingInvitations": "There are no pending invitations at the moment.",
        "noExpiredInvitations": "There are expired invitations at the moment.",
        "noInvitations": "There are no invitations at the moment.",
        "noCollaboratorUserInvitations": "There are no collaborator users with expired invitations at the moment."
    },
    "invitedUserLabel": "Managed by parent organization"
}
